id	title	abstract
582	Title Indexes as Alerting Services in the Chemical and Life Sciences	The principles underlying alerting services are discussed.. General alerting services (as distinct from SDI systems) need to transfer to their users a large quantity of current but mainly irrelevent information as speedily as possible.. As title indexes are the easiest to prepare and are therefore common, the user needs to know how much significant information is not discernible from a documents title.. This is estimated to be 20-25% but can vary with subject and type of information sought.. If a search of, say, Chemical Titles is made, ignoring synonyms but allowing for all syntactical variants, only about one third of the significant information will be recovered.. Synonyms and other nomenclature problems are discussed.. Delay times and time of use are the two most important factors in evaluating an alerting service and are reviewed for some typical services..
1261	The Ring Index	"The collection includes (1) simple parent rings and (2) parent systems of more than one ring in which the rings are united by having one or more atoms in common.  It thus comparizes simple and ""fused"" (ortho- and ortho-peri-fused), or annelated, systems (including spiro forms),  but not systems like biphenyl or triphenylmethane, in which the rings are united only by valences or by atoms not belonging to the rings.  Some systems are included in which a polar valence is involved, e.g. the four-membered ring of betaine, since these are often shown in formulas as if true rings; but in such cases the presence of the polar bond is noted.  Polar bonds in metallic salts (e.g. calcium succinate) are disregarded as ring formers; so also are coordinate linkages (as in the chelate compounds).  The word ""system"" is used to mean a single ring or a combination of rings united one to another by atoms common to both. Except for some special reason, only systems representing known compounds of generally accepted structure, or definitely believed by authors to have a certain structure, are included.  The fact that a compound must have one or two alternative structures is not sufficient for the entry of a system based on either of them.  Where there is doubt about an entry a query (?) is inserted after the reference."
577	Probabilistic Models for Automatic Indexing	This paper is developed in two stages.  The first stage describes an experiment that explores properties of the class of words that are not useful in conveying subject meaning and distinguishes them from those classes of words that do convey subject meaning to various degrees.  In particular, we study the clustering properties of these words; the analysis is based on statistical properties alone, and techniques are introduced that may be of value in other areas of information science.  On the basis of the results of this experiment, a model of word occurrences is introduced and discussed.  Later papers by us and by Harter will apply this model to indexing.
650	Relative Effectiveness of Titles, Abstracts, and Subject Headings for Machine Retrieval from the COMPENDEX Services	We have investigated the relative merits of searching on titles, subject headings, abstracts, free-language terms, and combinations of these elements.. The COMPENDEX data base  was used for this study since it contained all of the data elements of interest.. In general, the results obtained from the experiments indicate that, as expected, titles alone are not satisfactory for efficient retrieval.. The combination of titles and abstracts came the closest to 100% retrieval, with searching of abstracts alone doing almost as well.. Indexer input, although necessary for 100% retrieval in almost all cases, was found to be relatively unimportant..
809	A Single Computer-Based System for Both Current Awareness and Retrospective Search: Operating Experience with ASSASSIN	ASSASSIN as designed and operated by ICI Agricultural Division, provides from a single paper tape input a current awareness service by SDI and a retrospective search both by a weighted term machine search and printed KWOC-type indexes.. Programs for producing structured thesauri are part of the package.. Input is in the form of abstracts from both published and internal source.. The system has operated for more than a year at the Agricultural Division and is currently in use at five other locations.. Flexibility of the package is demonstrated by the variety of applications.. This paper outlines the various applications and shows how a single package may be used complete, or in part, or with modification.. Machine costs are given for the major application.. The system was designed with the possible input of externally produced machine readable data in mind.. The intended application of the package in conjunction with tapes such as those of the Institute for Scientific Information source and Chemical Abstracts Condensates is outlined..
1429	The Universal Decimal Classification	Purpose of this paper.  The purpose of this preliminary study is to attempt to discover how far it succeeds at present and how far and by what methods it may continue to succeed or be made to succeed in the future.  One person (or two, for Brian Vickery is tackling the problem from the point of view of scientific and technological users) with however many helpful consultants can only hope to isolate some of the problems and to indicate some of the possible solutions.  This, it is hoped, may prepare the ground and stimulate the critical and creative efforts of others towards fruitful developments.
922	Library Catalogs:  their preservation and maintenance by photographic and automated techniques; a study	The major conclusions and recommendations of the study which follows are: That the catalogs of The Research Libraries of the New York Public Library be divided chronologically at the earliest possible date; That the present (or retrospective) Public Catalog be reproduced photographically in book form; That the future (or prospective) catalogs be produced in a combination of card and book form from a store of machine-readable data; That a Central Serial Record be created to contain acquisition information, cataloging and holdings data, and bindery records for all serial publications in The Research Libraries.
330	Computer Readable Bibliographic Data Bases -- A Directory and Data Sourcebook	"This document, Computer Readable Bibliographic Data Bases -- A Directory and Data Sourcebook not only updates the 1973 publication, which included information on 81 data bases, but expands the coverage to 300 data bases and includes considerably more information about the data bases. Methodology used to obtain data involved:  (1) consulting published and unpublished sources; (2) design of a 13 page questionnaire; (3) mail survey; and (4) telephone follow up and verification.  The sources consulted were (1) the Survey of Commercially Available Computer-Readable Bibliographic Data Bases; (2) M.E. Williams' personal data base files which include information from the open literature, news releases, and personal contacts; (3) NEWSIDIC, April 1975 issue number 16, the quarterly newsletter produced by EUSIDIC which included a survey of computer readable bibliographic files; (4) the ""World Inventory of Abstracting and Indexing Services--Data Elements Definition List;"" and (5) the ASIDIC Survey of Information Center Services."
404	A Guide to the Library of Congress Classification	This guide is an introduction to the Library of Congress Classification; as such, it does not include instructions for every subclass or table, but attempts to provide the reader with an understanding of the characteristics of the classification, the arrangement within the classes, the format of the schedules and tables, and special problems of use and notation.  The reader should trace the analysis of each example of classing through the pages from the L.C. schedule provided in the guide.  It is important to remind the reader that a thorough study of each class schedule in addition to the recommended readings is essential.  The author realizes that many imperfections may be present in this guide and will appreciate suggestions for changes from readers.
586	An Evaluation of Index Medicus and MEDLARS in the Field of Ophthalmology	An evaluation of the performance of Index Medicus and MEDLARS in the field of ophthalmology is presented, using data generated by a separate study.. MEDLARS performance figures gave a screened precision ratio of 54% and a recall ratio of 42%.. Over the same set of questions Index Medicus had a screened precision ratio of 53% and a recall ratio of 46%.. Results for Index Medicus alone over a large set of questions gave a 73% screened precision ratio and a 47% recall ratio.. A random sample of MEDLARS and Index Medicus precision and recall failures showed that most of the Index Medicus recall failures resulted from manual searcher omission.. The major causes of Medlars precision failures were inadequate indexing terminalogy to express concepts and attempts at providing too exhaustive a search..
918	Library of Congress	The book was built on interviews with the Library's middle managers, on discussions with working specialists in the various divisions, on conversations with and questionnaires sent to out-of-Library users, and from my own observations through almost twenty-five years in the Library's Congressional Research Service.  After the text was completed, it was read by appropriate people in each department for factual content and ultimately by the staff in the Librarian's Office for their comment.  At no point was there pressure to change text or conclusions - although there were plenty of good-natured suggestions on details, and nearly everyone urged a fuller description of his own particular specialty!
1207	Technical Information Project	The model of a technical information system described there by Dr. Kessler involves a working literature taken from twenty-one journals in the field of physics.. The system, designed and constructed at the Massachusetts Institute of Technology as a prototype operating in a realistic test environment, uses remote consoles having access to a time-sharing computer facility.. Programs have been developed for a large variety of search and processing techniques in real time as well as for delayed output.. The work is supported by the National Science Foundation and in part by Project MAC, the experimental computer facility at MIT which is sponsored by the Advanced Research Projects Agency..
837	Information Requirements in the Social Sciences: Some Preliminary Considerations	Information requirements in the social sciences are almost entirely unexplored.. I shall argue that exploration is desirable; discuss some of the reasons why this is so; attempt an analysis of the factors to be investigated; and consider some possible methods of investigation.. This article is an early by-product of the Investigation into Information Requirements of the Social Sciences, being carried out by two researchers under my direction,and supported by the Office for Scientific and Technical Information.. It is based on the Report on the Preliminary Stage, presented to OSTI in April, 1968..
984	Cost Analysis Studies in Libraries: Is There a Basis for Comparison?	When the Chairman of the Technical Services Cost Committee asked the three of us to summarize the findings of the Colorado study on centralized processing, I agreed.  Later, I began to have second thoughts - I suppose because we were almost buried under an avalanche of data and it soon became apparent that we could not really summarize the findings of the study in one evening. The investigation took off in tangents that had not been originally anticipated.  As you have already been informed, the final report deals with such diverse topics as a faculty user attitude survey, mathematical model simulations of processing center operations, approval plan utilization, and an inter-institutional bookkeeping system, all in addition to the cost studies of acquisitions and cataloging in nine libraries.
1319	Scientific and Technological Communication	"My objective in this work has been to try to get at the fundamental aspects of the elements and media of scientific and technological communication and to describe the critical issues involving them as well as the opportunities and techniques for exploiting them which hopefully could aid both the ""users"" and the ""handlers"" of these important resources."
637	Breaking the Communication barrier Between Searcher and Literature File: An Interactive Guide	The challenges of design of programming systems, file organization and manipulation, and user-oriented query languages have held the spotlight in the development of data processing support to systems for retrieval of scientific literature.. At BIOSIS, development of such a system from the pragmatic viewpoint of providing viable self-supporting retrieval service from a data base of more than two million references has resulted in focusing attention on supporting the formulation of the information need into an effective computer search specification.. Developed under CPS and now implemented under CICS, the program claims no novelty of structure or technique, but constitutes an innovation in application and goal with primary emphasis on accommodating the behavior of a user not previously knowledgeable about the structure, indexing language, and detailed content of a machine based references file..
717	Current Information Dissemination: Ideas and Practices	A detailed description and a tabulated summary of the salient feature of 17 current awareness information services are presented to illustrate various approaches to handling the current information dissemination problem..
873	Content Designators for Machine-Readable Records: A Working Paper	"Under the auspices of the International Federation of Library Association's Committees on Cataloging and Mechanization, an International Working Group on Content Designators was formed to attempt to resolve the differences in the content designators assigned by national agencies to their machine-readable bibliographic records.. All working papers emanating from the IFLA Working Group will be submitted to the International Standards Organization Technical Committee 46, Subcommittee 4, Working Group on Content Designators.. Prior to any attempt to standardize the content designators for the international exchange of bibliographic data in machine-readable form, it is necessary to agree on certain basic points from which all future work will be derived.. This first working paper is a statement of: 1) the obstacles that presently exist which prevent the effective international interchange of bibliographic data in machine-readable form; 2) the score of concern for the IFLA Working Group; and 3) the definition of terms included in the broader term ""content designators"".. If an international standard format can be derived, it would greatly facilitate the use in this country of machine-readable bibliographic records issued by other national agencies.. It should also contribute significantly to the expansion of MARC to other languages by the Library of Congress.."
510	Retrieval Efficiency from Titles and the Cost of Indexing	By the means of the flexible machine search system three experiments have been made in order to test the retrieval efficiency of searching free text and keywords.. Base upon the relevance judgements of the users, the results indicate that titles and abstracts are good index material which can be used for machine searching without human indexing in the three fields studies..
1247	Reader in Library Cooperation	This volume is intended as a means of exploration for the practicing librarian and as a textbook for the library school student.  It will try to draw attention to significant social, behavioral, theoretical, organizational, functional, and operational generalizations about library interrelationships; and to suggest a sense of the total fabric of the cooperative endeavor.  It does not aim at identifying and incorporating the forms and the range of library cooperation in which individual libraries seek to extend the limits of their separate capabilities.
204	Analysis of Recorded Biomedical Book and Journal Use in the Yale Medical Library Part II. Subject and User Relations	Cancelled charge slips collected over a one-year period supply the data for this analysis of circulation in the Yale Medical Library.. Full-time teacher faculty are the heaviest users of journal literature, and  students, of monograph literature.. Faculties of Medical School departments are compared in terms of their use of material in individual subjects.. Subject literatures are analyzed in terms of groups of users borrowing from them.. The extent to which journal titles used by medical students  are also used by Medical School faculty is examined.. One of the products of the study is a rank list of journal titles used in the Library.. Results are presented in several tables..
401	Future Shock	"This is a book about what happens to people when they are overwhelmed by change.  It is about the ways in which we adapt - or fail to adapt - to the future. Much has been written about the future.  Yet, for the most part, books about the world to come sound a harsh metallic note. These pages, by contrast, concern themselves with the ""soft"" or human side of tomorrow.  Moreover, they concern themselves with the steps by which we are likely to reach tomorrow. They deal with common, everyday matters - the products we buy and discard, the places we leave behind, the corporations we inhabit, the people who pass at an ever faster clip through our lives.  The future of friendship and family life in probed.  Strange new subcultures and life styles are investigated, along with an array of other subjects from politics and playgrounds to skydiving and sex."
715	Articulation in the Generation of Subject Indexes by computer	"A simple and logical model for the automatic generation of subject indexes from title like phrases is described, and its advantages and disadvantages are discussed.	It is based on recent studies of the structure of articulated subject indexes, such as those to Chemical Abstracts.  The model employs the prepositions and connectives of phrases of simple structure as articulating points, and selects from all possible forms of entries those which lead to optimal organization in an index.  The technique is illustrated with part of an index to a recent abstracting journal.  The wide variety of controls which can be exerted by the indexer and the program is discussed."
63	The Publication Inflation	"The much-vaunted information explosion seems to be the manifestation of a rather generalized publication inflation.. Multipublication and pretentious writing have become obstacles to ""communication between human minds"". To counteract their harmful effects it will be necessary to reduce the quantity and improve the quality of the printed records by filtering the material before it is stored for retrieval.."
617	On-Line  Serials Control System in a Large Biomedical Library; 1) Description of the System	An on-line serials control system with particular emphasis on storage and maintenance concepts is described.. The system, operational since January, 1971, has evolved from a former batch card system and remains completely compatible with it.. The system allows real-time display and updating of all elements of the file.. Consequently all check-in, bindery, and claims operations, as well as new entries and data field changes are accomplished on a real-time basis.. All programs are in PL/1.. Required equipment is an IBM time-shared facility with 100 K memory available for the applications programs, and IBM 2260 display units.. This article is the first of three.. The second is concerned with an analysis of inverted file retrieval features and the third compares the operation of the on-line with the batch system, comparable manual operations, and discusses costs..
1236	Public Libraries in Cooperative Systems; Administrative patterns for service	"This book was written as an introduction to the administrative relationships between small and medium-sized public libraries and the cooperative library system.  In this book, the definition of a cooperative system is as follows:  A cooperative library system is the combining of the talents and the resources of a group of independent libraries, within a reasonable geographic radius, for the purpose of attaining excellence in service and resources for the benefit of the actual and potential users of all the member libraries.  The plan for the book originated with questions directed to a public library administrator and to a system director.  The most pertinent of the repeated questions was, ""How does system membership change local library administration?""  The sharpest question was, ""Will the system ultimately take over local rights and responsibilities?"""
690	Experience with the Mechanized Chemical and Biological Information Retrieval System	New computer methods have been developed in associations with the drug development programs of the Walter Reed Army Institute of Research.  Experiences with these systems are recounted.  Special input devices and computer programming have been developed for the input and retrieval of conventional chemical structural diagrams.  The costs, operation, and the advantages of this system are discussed.  Associated files of biological properties and inventory control information have been created, which are searchable.  The methods used in creating consolidated listings of selected chemical compounds and associated biological data are discussed.
970	Fields of Information on Library of Congress Catalog Cards: Analysis of a Random Sample, 1950-1964	"The Information Systems Office (ISO) of the Library of Congress has as its mission the development and implementation of the main automation program for the Library and the co-ordination of all LC automation efforts. One of the primary activities in this effort is a system-development study concentrating on the central bibliographic operations, that is, acquisitions, cataloging, reference, etc.  This study is now in its early stages, and it is too soon to predict the actual system that will evolve. As an adjunct to this study an analysis of the potential uses of and problems involved in the machine processing of cataloging data was begun.  One aspect of the analysis was the design of a preliminary machine- readable catalog record.  The results of this work are in a report issued by the ISO as its ""Planning Memorandum Number 3."""
991	Filing Arrangement in the Library of Congress Catalogs	New filing rules have been developed for the catalogs of the Library of Congress to ease the tasks of filers and users and to pave the way for computer-assisted filing.. This article discusses preliminary considerations about the functions of large bibliographic files,the complexities of cataloging, the interaction between users and catalogs, and ways to simplify arrangements.. The assumptions and principles that underlie the proposed rules are stated, and their organization and anticipated use are described.. An abridged version of the rules is illustrated by an extended example..
1165	Issues in the informational analysis of documents.	In scientific process and primary scientific documents there are objective characteristics, which allow the accurate and unambiguous reflection of the form and content of primary statements n the informational analysis of their secondary pattern. Using these characteristics allows one to develop a model of standardized bibliographic and abstract document description and minimize subjectivity in information analysis. The objective characteristics of form and content of documents and corresponding elements of bibliographic and abstractive description must be based on application of classification schemes. For each characteristic there must be a corresponding scheme of particular structural complexity.
1014	The Microform Revolution	"Librarians have tried replacing some of their books and journal files with microfilm copies or other microforms in order to save valuable space in the bookstacks, instead of or in addition to extension of the stack area, decentralization, compact shelving, separate storage warehouse, or any of the other solutions to the storage problem discussed in earlier chapters.  As a final paper, this solution for the storage of library materials will be discussed.  Although the distinct forms will not often be designated, ""microform"" is used here to mean the four forms most common in the United States: 35 mm. roll microfilm, microfiche (now standardized in the United States and Great Britain at 4 by 6 inches) and the two micro-opaque forms - 3 by 5 inch Microcard, and 6 by 9 inch Microprint."
212	Thesaural Problems in an On-Line System	This paper describes the construction of a synonym thesaurus or entry vocabulary for the SUNY Biomedical Communication Network, which will permit the user greater ease of access to MeSH-indexed material without previously consulting a printed list of indexed terms.. In order to discover the actual terminalogy used by a researcher, words were extracted from titles of articles appearing in Index Medicus, and compared with the subject heading under which they appeared.. As well as strict synonyms, grammatical variants were also included.. Work is continuing on relating other indexing vocabularies, such as Excerpta Medica and Current Medical Terminalogy, used in the biomedical world to MeSH terms..
