id	title	abstract
209	Survey of the Card Catalog in Medical Libraries	A survey of present uses and arrangement of medical library card catalogs was made in order to determine current practices and trends.. Attention was focused on the influences of MeSH on the card catalog.. The results indicate that the prevalent type of card catalog found in medical libraries is the divided catalog.. In addition, it appears that this catalog arrangement is gaining acceptance, and the trend is toward division.. MeSH has an effect on the organization of the card catalog; libraries indicate that it is an influential factor in the decision to divide the catalog..
881	Impact of National Developments on Library Technical Services and Public Services	Several recently established national programs are evaluated from the point of view of the practicing librarian.. It is essential that we be aware of the consequences of adopting these programs, and that planners and librarians communicate adequately..
1203	Patterns in the Use of books in Large Research Libraries	The accumulative growth, without limit in ultimate size, of the general research library must produce stresses and strains that many institutions will find difficult to resolve.  The rising costs of space for library buildings and bookstacks; the scarcity of centrally located campus land; aesthetic and functional limitations on the heights, bulk, and areas of library buildings; and increasing complexity in the organization of materials and services for the efficient use of large research collections, are illustrative of some of these stresses and strains.
702	The CA Integrated Subject File.  II. Evaluation of Alternative Data Base Organizations	The relative retrieval performances of the CA Integrated Subject File (CAISF), CA Condensates, and a Merged File created from these two data bases have been measured.  Retrieval performance is reported in terms of recall and precision values as well as costs.  The precision and recall retrieval failures - i.e., irrelevant documents and missed documents - have been analyzed for each data base and characterized according to the five major types of failures: index language, indexing, searching, clerical, and miscellaneous.  Over-all analysis of the performance suggests that an effective data base can be created by augmenting the CA Condensates data base with Registry Numbers and some representation of the CAISF General Subject concept headings, which results in a file approximately half the size of the corresponding CAISF data base and is suitable for search using existing retrieval system software.
3	Two Kinds of Power An Essay on Bibliographic Control	The relationships between the organization and control of writings and the organization and control of knowledge and information will inevitably enter our story, for writings contain, along with much else, a great deal of mankind's stock of knowledge and information.  Bibliographical control is a form of power, and if knowledge itself is a form of power, as the familiar slogan claims, bibliographical control is in a certain sense power over power, power to obtain the knowledge recorded in written form.  As writings are not simply, and not in any simple way, storehouses of knowledge, we cannot satisfactorily discuss bibliographical control as simply control over the knowledge and information contained in writings.
882	CONSER: An Update	The purposes of this paper are to explain what the CONSER Project is, to answer some of the questions that have been raised concerning it, and to make some general comments on the problems associated with this type of project.. This paper will not attempt to review in detail the history and operational facets of the project since these are available elsewhere..
563	A Study of Methods for Systematically Abbreviating English Words and Names	This study investigated various techniques for systematically abbreviating English words and names.. Most of the attention was given to the techniques which could be mechanized with a digital device such as a general purpose digital computer.. Particular was paid to techniques that could process incoming  information without prior knowledge of its existence (i.e., no table lookups).. Thirteen basic techniques and their modifications are described.. In addition, most of the techniques were tested on a sample of several thousand subject words and several thousand proper names in order to provide a quantitative measure of comparison..
1061	Milestones in Cataloging	"In the case of the present study, Dr.Lehnus was interested in applying a method - in a non-standard way for that method - to a type of literature that had not been addressed so far.  He proposed to begin with a single monograph on the subject ""cataloging,"" apply the method of citation analysis to the references of that work, and determine whether a core literature on cataloging could be discovered in this way.  There are innumerable examples of core literatures in scientific fields obtained from journal articles or through the Science citation index, but research via the monograph in non- scientific subjects has been minimal."
117	TOSAR - A Topological method for the Representation of Synthetic and Analytical Relations of Concepts	In mechanized systems used for searching in literature stores there is a steadily growing necessity not only to be able to formulate concepts as a search condition but also the characteristic connections under which these concepts appear in the inquiry.. In this way the precision of the mechanized literature search is considerably increased.. TOSAR has been developed in order to improve computerized literature searching in this respect..
1027	Linguistics and Information Science	This study was commissioned by the Committee on Linguistics in Documentation of the Federation Internationale de Documentation (FID). It is concerned with the linguistic aspects of information science, and in particular with the linguistic components of document analysis, description, and retrieval.  We have attempted to relate linguistics and information science by considering the theories and techniques linguistics has to offer, and how far these have been, or could be, exploited by information scientists.  We have examined these questions within the context of automated language processing and automated documentation.  The use of computers for linguistic operations presents special challenges as well as interesting possibilities, and we have chosen to approach the field from this particular point of view.
1359	Time and Motion Study of Library Operations	Application of standard work measurement techniques to acquisitions, cataloguing, and circulation functions of an aerospace library is described.  Sample of a representative production unit in included. A 38 per cent saving in manpower without loss of quality effort proves the library environment responds admirably to this management tool.
1010	The Science Citation Index: A New Concept in Indexing	"The purpose of this paper is to discuss citation indexing and its present application as exemplified by the Science Citation Index, published by the Institute for Scientific Information as a new, unique, and necessary tool for scientific work.  It is necessary, therefore, to describe briefly, and in general terms, the nature of conventional subject indexing systems in order that a basis for contrast between these and citation indexing can be obtained.  For those who wish to read extensively on the subject of indexing, references are provided at the end of the paper under the section ""Additional References."""
1032	Londoner and His Library	This report deals with a complementary theme: the public for which the public library service is provided.  It does this in two ways - by giving information about the nature of that public, as it is at present made up, and by reporting what people say about public libraries, not only those who are members, but also those who used to belong and those who never have.  Its closest relatives in British writing on this subject are, therefore, Mass Observation's now dated Reading in Tottenham (1947) and the Society of Young Publishers' Survey Books in London, 1959.  It is more comprehensive in scope and more detailed in its analysis that the Tottenham survey, while it goes in some depth into issues that necessarily played only a small part in Books in London.
378	Dialog Interactive Information Retrieval System	DIALOG is the name given to an interactive, computer-based information retrieval language developed at the Lockheed Palo Alto Research Laboratory. The DIALOG systems consists of a series of computer programs which have been designed to make full use of direct access memory devices (in which data located anywhere on the device can be accessed in approximately the same amount of time) and video display units to provide the user a rapid and powerful means of identifying records within a file which satisfy the particular information need.  By providing the user full display access to the indexing vocabulary, and the ability to modify search expressions, DIALOG becomes a data processing extension of the human operator who directs and controls the process according to his own personal needs.
947	Library Networks	The combination of computers and communications technology is a development whose time has come for libraries in the U.S. And despite missteps and false starts inevitable in adapting the new technology for its use, libraries are now rapidly expanding telecommunications networks to serve their need to disseminate ever-expanding amounts of information in more effective ways. It makes a good deal of sense when one considers that the library's function is to parcel out information, and that information can be forwarded electronically as easily as it can be mailed. In fact, the logic of library networks is such that everyone is hopping on the bandwagon -- consultants, systems analysts, state agencies and a growing list of manufacturers that includes Xerox and International Business Machines.  Their initial efforts are concentrated on what are basically bookkeeping tasks -- in particular, the cataloging of new acquisitions.  The Ohio college Library Center, for example, provides its customers with entries for their card catalog files; and because OCLC is the first and most extensive of the networks, its approach is being closely copied by the others.
1348	Sociology and Modern system Theory	This book is intended as an exploratory sketch of a revolutionary scientific perspective and conceptual framework as it might be applied to the sociocultural system.  This point of view and still developing framework, as interpreted here, stems from the General Systems Research movement and the now closely allied fields of cybernetics and information or communication theory.  The principal goal of the book is to bring to the attention of a larger number of social scientists, particularly sociologists, the wealth of principles, ideas, and insights that have already brought a higher degree of scientific order and understanding to many areas of biology, psychology, and some physical sciences to say nothing of the applied areas of technology to which they are essential.
406	Guidelines for Library Automation; a Handbook for Federal and Other Libraries	This book is one of the products of a contract initiated by the Automation Task Force of the Federal Library Committee, sponsored and monitored by the U.S. Office of Education, and carried out by the System Development Corporation.  The project included a questionnaire survey of all Federal libraries (2104), as of December, 1970, to gather systems planning data and to identify Federal libraries with operational or planned automated systems. Respondents in the latter group were sent a Federal Library Automation Survey questionnaire requesting specific details about existing and planned systems. From these sources, amplified by visits to Federal libraries and an extensive review of the automation literature, information was distilled for use in this Handbook.
628	The Environment of Classification: The Concept of Mutual Exclusivity	It has been suggested that information science is still of the stage of alchemy:  if this is so then mutual exclusivity must form its philosopher's stone.. Mutual exclusivity appears to be alien to the observable universe:  that this is so is displayed through a series of examples.. Some of these relate to everyday things like trees, beaches and man himself,  whilst others relate to more obscure phenomena like continental drift and black holes.. The act of observation is also considered as this has a considerable bearing on the problem.. Nevertheless, mutual exclusivity must form part of man's mental powers and this has found expression in the relatively exclusive series of symbols used in communication.. The dangers of exclusive thinking in relation to environmental problems are considered, and this results in a paradox which is probably unresolvable.. Finally, it is observed that out-standing genius appears to pay scant regard to existing classifications and is more likely to be involved in an integrated approach to problems..
641	Representation of Concept Relations Using the TOSAR System of the IDC: Treatise III on Information Retrieval Theory	Successful information retrieval from a mechanized file is heavily dependent on the fidelity of the representation of concepts in the particular language of the system and on the predictability of this representation.. If an index language is employed, predictability is guaranteed and the quality of the retrieval is predominantly governed by the fidelity of the representation, i.e., by the extent to which conceptual distortion of the concepts to be represented can be avoided.. The various index languages vary widely with respect to their fidelity.. Differences in their performance are correspondingly great.. The lack of fidelity in most of the present day indexing languages is due mainly to insufficient representation of the relationships among concepts.. We describe a new graphical method of storing and retrieving concept relations of various kinds.. The points of such a graph are occupied by concepts, and the connecting lines between these points represent concept relations.. In a special field of chemistry, these graphs also serve as a kind of presentation of the essentials of a document to the reader that is much more lucid than a natural language text..
668	The Automatic Encoding of Chemical Structures	"Many methods for the coding of chemical structures have been described in the literature.	Some methods code the compound only partially; typical of these are the methods using descriptor codes.  Other methods, among which the so-called ciphers are prominent, code compounds exhaustively.  All these methods require cerebral effort; that is, a chemist is needed who must have learned the rules of the code, and who must known how to dismember correctly each structure to be coded.  A disadvantage of code designations of structures is, furthermore, that they are not generally understood by chemists.  No advantages accrue to the chemist from knowing how to generate and how to interpret a chemical code.	Codes are needed only for the mechanical manipulation of chemical structures.  Clearly then, if the coding of chemical compounds could be accomplished automatically this automatic conversion would relieve the chemist of considerable burden."
202	Medical Libraries and the Assessment of User Needs	Users of information in science and technology have been studied in great detail with respect to material read, amount of time spent in reading and searching the literature, categories of questions asked, an so on.. Probing for this information has been undertaken by means of structured  and unstructured  interviews, diaries, surveys, and questionnaires.. Although a large amount of data has emerged on information usage and flow, the subjective response of scientists furnishes comment only on the satisfaction produced by present information services and does not yield insight into the extent to which needs remain unsatisfied.. Relevance  figures based upon the response of systems to questions cannot be equated with satisfaction of needs, since questions constitute, in most cases, inadequate representations of underlying information needs.. Assessment of the needs of users of medical libraries and information system must, in fact, be made in relation to the observed behavior and experience of biomedical scientists.. There is room for well-designed experimentation which can explore the interaction of both psychological and environmental factors.. Significant differences in information needs exist among and between individuals such as researches and clinicians  in the same environment.. With respect to environment, it is hypothesized that the information needs for medical practitioners in remote areas might differ significantly from those of their colleagues working in large metropolitan centers in close proximity to medical schools, research institutions, and other rich sources of information fallout.. It is anticipated that experimentation will eventually result in a methodology which will permit the determination and prediction of the information needs of any identified groups of users in a specific environment..
1327	The SMART Retrieval System Experiments in Automatic Document Processing	The automatic SMART document retrieval system was designed at Harvard University between 1961 and 1964, and has been operating of IBM 7094 and 360 equipment both at Harvard and at Cornell University for several years.  The system takes documents and search requests in the natural language, performs a fully automatic content analysis of the texts using one of several dozen programmed language analysis methods, matches analyzed documents with analyzed search requests, and retrieves for the user's attention those stored items believed to be most similar to the submitted queries.
154	The UDC in its International Aspects	Universal Decimal Classification - dying duck or live bird? - or some such title - was suggested to me, but this is highly debatable, and there will hardly be time for the duck-shooters to develop a concerted onslaught in the half-hour or so allowed us for discussion.  Besides, I hope to be able to convince you - if the BSI's fine efforts have not already done so - that the UDC is by no means the dying duck - certainly not the dead duck - that some of its severest critics seem to imagine.  Perhaps the bird has ceased to soar as it once did in the times of Otlet, La Fontaine, Bradford and Donker Duyvis, but that it is still viable in the turbulent air of current documentation may be gauged from a recent FID inquiry aimed at obtaining figures for the distribution of UDC editions and an approximate estimate of the number of users throughout the world.
848	A Book Catalog at Stanford	Description of a system for the production of a book catalog for an undergraduate library, using an IBM 1401 Computer (12K storage, 4 tape drives), an expanded print chain on the 1403 Printer, and an 029 Card Punch for input.. Described are the conversion of cataloging information into machine readable form, the machine record produced, the computer programs employed, and printing of the catalog.. The catalog, issued annually, is in three parts: an author title catalog, a subject catalog, and a shelf list.. Cumulative supplements are issued quarterly.. A central idea in the depiction of entries in the catalog is the abandonment of the main entry concept.. The alphabetical arrangement of entries is discussed: sort keys employed, filing order observed, symbols employed to alter this order, and problems encountered.. Cost factors involved in the preparation of the catalog are summarized..
308	The Coming Crisis of Western Sociology	"The criticism and transformation of society can be divorced only at our peril from the criticism and transformation of theories about society.  Yet the gap between theory and practice, so common in the history of American radical movements, is in some quarters growing wider.  Some of the most militant of American radicals, in the New Left or in the movement for Black liberation, have at least temporarily avoided any serious concern with social theory. This neglect of theory doubtless has various origins.  In some part it is due to the fact that these social movements are still new and their political activism consumes their necessarily limited energies and resources; the new radicalisms will, in short, need time to produce their new theories.  Although the neglect of theory is scarcely peculiar to Americans, it is in part also due to the fact that American radicals are often more American than they know and may prefer the tangible outcomes of pragmatic politics to the intangible outputs of theory.  Again, part of their neglect of theoretical problems is probably due to the close links that some young radicals have with the ""hippie"" contingent of their generation, whose more expressive and aesthetic styles of rejecting American culture dispose them to avoid what they take to be the sterile ""hassles"" of intellectual confrontation.  There is also a vocal minority who, as has been said, feel personally excluded when they hear an appeal to reason."
1321	Scientists in Organizations Productive Climates for Research and Development	This book is addressed to scientists and engineers, to administrators of research and development, and to all others who are concerned about the effects of organizations upon the work of their members.  This book is one of the first major studies to examine the relationship between a scientist's performance and the organization of his laboratory.  Unlike many previous expositions about the best environment for technical people, the findings resulted from extensive analysis of factual data from a wide range of research personnel. Work progressed over the next four years, and a number of intriguing results began to emerge.  But as these were discussed with other investigators studying different kinds of R & D laboratories, discrepancies appeared.  It became clear that a broader study was needed before one could be sure what constitutes a stimulating environment for research personnel.  We set out to design a study in which standardized instruments would be administered to scientists and engineers in several types of laboratories.
267	System Analysis in University Libraries	A comprehensive enginnering approach to the analysis and functional design of library systems is described in terms of fundamental space-time relationship which characterize university libraries.. Long-run trends in aquisitions and circulation are related to the relative obsolescence of stored materials, and the uncertainty of short-run demand pattern is related to the need for excess service capability.. The spatial dispertion of library resources among specialized information centers and central depositories is considered with respect to availability, retrieval, duplication, and efficient storage..
129	Generation and Uses of Machine-Readable Data Bases	This chapter continues the coverage of the generation and use of machine-readable data bases inaugurated in Volume 9 by Williams (178).  It is therefore an update consisting primarily of 1974 material and is prepared in general accordance with Williams's initial compilation. The same definition of data bases and the boundaries of their applications used in Volume 9 are continued this year.  A data base is considered to be an organized collection of machine-readable records containing bibliographic and/or document-related data (e.g., index information). The data bases that we will consider are used for information storage and retrieval and/or research in information storage and retrieval or data base generation. The choice of these constraints precludes coverage of several areas.  First, data bases primarily concerned with numerical or other nonbibliographic information, such as chemical structures, (Milen et al., 112) are excluded. Thus, even though the Chemical Abstracts Service (CAS) Registry Number is a data element common to many bibliographic data bases, papers such as that by CAS regarding progress in building the Registry System itself (39) are excluded.  Similarly, though some textual and bibliographic material is included in the Systems Consultants, Inc report (156) to the Navy, most of the information retrieval is concerned with miniaturized hardware in a shipboard environment and thus is not considered within the scope of this chapter.  Finally, though many of the data bases are used for generation of publications via phototypesetting, we are not considering that production operation.
1420	Time-Lag in Cataloging	Any who have the arduous task of assisting a student through that ultimate of academic exercises, the preparation and defense of a dissertation, are likely to define happiness as a good book written by an advisee.  This book is a cause of joy.  The author expended much more effort than is usually the case to gain even the smallest detail, because the subject matter is strangely intractable, hedged round with perplexities and not a few vested interests.  Letters and reports get locked away where they may not be seen except by the most persistent investigator and one who somehow meets criteria that no one else can claim.  In the end, the author deserves the praise and the advisor is well rewarded with the inner satisfaction that comes from participation in an important investigation finished as an influential and well-written book.
