id	title	abstract
1415	Computer-Based Selective Dissemination of Information (SDI) Service for Faculty Using Library of Congress Machine-Readable Catalog (MARC) Records	"From November 1966 through June 1968 the Library of Congress conducted a pilot project involving the weekly distribution of its traditional 3x5 catalog cards in machine-readable form.. The MARC records provided a search data base for an experiment in current awareness service designed to furnish faculty with biweekly lists of bibliographic notices of new monographs in their specified fields of interest.. Of the 298 social sciences faculty members queried about their interest in participating, 209 (70 percent) responded affirmatively.. Only 40 participants could be accommodated, so they were chosen in proportion to the number of faculty members in each department or school:  anthropology-l, business-10, economics-3, education-15, government-4, history-4, and sociology-3.. An ""interest"" statement from each faculty member was translated into both Library of Congress classification numbers (e.g., E6ll) and subject heading terms, i.e., elements of discrete heading separated by a comma, dash, parenthesis, or period (e.g., U.S.--HIST.--CIVIL WAR--PRISONERS, EXCHANGE OF becomes six terms:  U/S/HIST/CIVIL WAR/PRISONERS/EXCHANGE OF).. The resulting ""interest profiles"" were recorded on punched cards for computer matching with subject headings and class numbers.. The weighted term search strategy was used in comparing profiles with MARC records.. Each profile was assigned a ""cutoff weight"" or ""hit level"" of 6.. Subject heading terms were assigned positive or negative weights so that the sum of weights on matching terms would be equal to, exceed, or be less than the hit level, thereby appropriately causing or preventing the selection of a particular record.. All class numbers were assigned a weight of 6 so that a hit would occur on any matching number.. Three computer programs were employed in producing the SDI lists.. Program Extract used MARC Master Tapes as input and extracted the card number (accession number), subject heading terms, and class number for current records; Program Retrieve compared these terms and class numbers with those in the profiles and recorded the card numbers for ""hits""; Program Print compared these card numbers with those on complete MARC records and printed three copies of each record to be sent to the faculty.. One copy was for the faculty member's own use; one was to be evaluated and returned; and one was to be used for making recommendations to the library.. Subject headings proved to be more effective in searching the MARC file mainly because multiple subject headings may be assigned to each record, whereas there is only one class number; and a hit often occurred on a record's second or third heading.. The SDI system performed well in selecting performed well in selecting relevant records, and overall evaluations were highly favorable.. Some 73 percent of notices received by faculty members were for works judged new to the faculty.  The majority felt that the SDI service provided an automatic, regular  notification of new works.. They felt that it usually brought works to their attention quicker than other sources; it informed them of items they otherwise would have missed; it furnished a compact source listing books in all but only their fields; it required very little time; and it provided a convenient means for making library recommendations and therefore increased the amount of recommending done.. All faculty expressed a desire to have SDI service continued.."
334	Concepts and Subject Headings	Librarians are known for their organizational work with recorded knowledge.  Information storage and retrieval are two well-known, basic functions associated with this work.  A search of the literature of library science reveals that these functions have not been examined to any significant degree from the users' point of view.  This is true in regard to library catalogs and library subject headings.
468	Analysis of On-line Searching Costs	A project was undertaken to discover the major determinants of the costs of searching, on-line, on a practical reference retrieval system (SCISEARCH).. The methodology and some results of this project are reported.. Controlled searches were undertaken to isolate the effect of each of a number of variables.. A model involving several of the major variables was then developed.. The general approach proved to be (in this case) both feasible and useful..
820	Studies to Compare Retrieval Using Titles with that Using Index Terms. SDI from 'Nuclear Science Abstracts'	A Selective dissemination of Information service based on computer scanning of Nuclear Science Abstracts tapes has operated at Harwell since October 1968.. Users' interest profiles are constructed using Euratom index terms and NSA subject categories assigned to each item in NSA.. The performance of the mechanized SDI service has been compared with that of the pre-existing current awareness service which is based on visual scanning of journals and reports by information staff.. The visual service was found to be providing an important service of good currency and high precision, about 85%, to a limited number of users.. the mechanized service is less selective and of lower precision, approximately 50%, but can be expanded more readily.. In order to compare the effectiveness of Euratom index terms and words on titles for computer SDI matching, an experiment was set up in which sixty users of the mechanized service assessed NSA document notifications which were generated by matching either index terms and subject categories, or words in titles and subject categories, without being aware of the method of matching.. Over 10,000 document assessments, fron six issues of NSA were returned.. The average precision was 45.6% for index terms and 47.3% for title words.. Index terms retrieved more documents, in the ratio 1.13:1, but both systems missed many relevant documents retrieved by the other.. Index terms retrieved only 58% of the relevant documents selected by titles.. The converse ratio was 51%.. No significant effects of document types or subject on the relative effectiveness of two matching systems were found, but when the results were analyzed by title length it appeared that for titles longer than about 100 characters title words gave recall equal to that of index terms, though with a lower precision.. A detailed study of samples of items found by visual scanning but missed by computer matching or found by one computer method but not by the other, was made to identify reasons for failure..
1365	Centralization vs. Decentralization: A Location Analysis Approach for Librarians	An application of location theory to the question of centralized versus decentralized library facilities for a university, with relevance for special libraries is presented.  Locating university libraries near classrooms, offices, and dormitories requires a larger budget than combining these libraries into a centralized facility.  Yet there is a cost to the university community which does not appear in the university budget - a cost in time, energy, and decreased use resulting from locating the library a longer distance from users.  The analysis provides models for a single library, for two or more libraries, or for decentralized facilities.
968	The Ecology of Privacy	The purpose of this article is to discuss the part played by the library environment in regulating interaction between people.
250	Centralized Processing for Academic Libraries; final report of the Colorado Academic Libraries Book Processing Center; the first six months of operation	This is the final report of the Colorado Academic Libraries Book Processing Center (CALBPC) project.  The CALBPC project was begun in 1965 by nine academic libraries in Colorado in an effort to establish a centralized acquisition and processing center.  The report of Phase I-II, completed in June 1968, dealt primarily with a general feasibility study, the design of the central system, costs of acquiring and processing in nine libraries and a number of related concerns such as accounting, the congruence of approval plans and user attitudes toward library services. This report focuses on the experimental operations which were concluded officially on September 30, 1969.  Whereas the Phase I-II study dealt with the theory and principles upon which a system might be based, we are presently concerned with the pragmatics of book processing, the obstacles encountered, and the solutions achieved. Although this report deals primarily with cooperative acquisitions and processing, we believe it also contributes to a better understanding of cooperative programs.  The experiment was designed to monitor operations throughout the acquisition/ cataloging cycle.  Performance and cost measurements were made on most internal and external aspects of the system.  Monitoring also extended into the participating libraries where a product acceptance study was conducted.  A secondary objective of the project was to observe the relationships which formed between the participants and the central agency, such as the interface of systems and the human interaction of participants and the Center.
1285	Networks of Scientific Papers	This article is an attempt to describe in the broadest outline the nature of the total world network of scientific papers.  We shall try to picture the network which is obtained by linking each published paper to the other papers directly associated with it.
1198	Proceedings.  Conference on Interlibrary Communications and Information Networks	Librarians and information scientists are vitally concerned with network development for a number of important reasons. First, the network concept implies removal of all geographic barriers to knowledge; this is made possible by advances in telecommunications technology.  Second, a network implies equal access by any individual for any purpose to the sum total of the nation's knowledge resources; this has been a long-standing educational goal.  And third, a network implies positive redirection of the basic professional goals and objectives of librarianship and information science.
486	Relevance Assessments and Retrieval System Evaluation	Two widely used criteria for evaluating the effectiveness of information retrieval system are, respectively, the recall and the precision.. Since the determination of these measures is dependent on a distinction between documents which are relevant to a given query and documents which are not relevant to that query, it has sometimes been claimed that an accurate, generally valid evaluation cannot be based on recall and precision measures.. A study was made to determine that effect of variations in relevance assessments on the average recall and precision values used to measure retrieval effectiveness.. Using a collection of 1200 documents in information science for test purposes, it is found that large scale differences in the relevance assessments do not produce significant variations in average recall and precision.. It thus appears that properly computed recall and precision data may represent effectiveness indicators which are generally valid for many distinct user classes..
295	An Approach to the Measurement of Use and Cost of a Large Academic Research Library System: A Report of a Study Done at Columbia University Libraries	A description of the methodology used in collecting performance data in a large academic research library is given.. Twelve types of surveys used to measure and evaluate users, services, and materials were developed and conducted during the period 1968/69 at Columbia University libraries and later evaluated.. Sample results are included.. Costs of providing research services were found to be 64 percent versus 36 percent for instructional services..
1314	Popper's Mystification of Objective Knowledge	For Popper, science is the very epitome of objective knowledge.  The central papers of his latest book argue and elaborate on this theme.  He says: All work in science is work directed towards the growth of objective knowledge.  We are workers who are adding to the growth of objective knowledge as masons work on a cathedral. I will first make some preliminary points about the word 'objective'. This will give substance to issues which are in danger of becoming too rarefied.  Second, I will outline Popper's account of objectivity.  Third, I will argue that despite the value of what he says, his approach is seriously misleading.  I will propose a formula for systematically transforming Popper's theses and exposing what is important in them.  This 'transformative method' points the way towards an entirely different conception of what makes knowledge objective.
224	The Implementation, Evaluation, and Refinement of a Manual SDI Service	The Missouri Institute of Psychiatry Library has implemented an inexpensive, manual SDI (Selective Dissemination of Information) service based upon the monthly issues of Index Medicus.. The implementation and refinement of the system are documented, and the very favorable response to the system is examined.. The SDI service is compared to Current Contents, with the finding that 60 percent of the SDI participants prefer it to Current Contents.. For this select portion of researchers the Index Medicus SDI is the more suitable mode of current awareness.. For a significant portion of the MIP staff, however, the score of Index Medicus is too restricted to suitable replace Current Contents.. All SDI users find it highly acceptable curent awareness service for use in addition to Current Contents and have indicated the desire to continue participation in the service..
155	Subject Relations in Science/Technology Literature	The analysis of citations has often been employed to indicate the use of the literature of science and technology.  Citation is only an indicator of use, not an accurate measure, and like all such indicators has defects. Differences between indicators have been discussed elsewhere. Despite these defects, an examination of citations does enable one to sample acts of literature use within a large community.  The study reported here was directed, in fact, to all United Kingdom authors of science/ technology publications in a given year, and because of its width, and the type of analysis performed, is considered to be worth reporting.  The study was primarily undertaken to obtain comparable information about social science literature, and this has been reported elsewhere.
361	Documentation	"Since the first publication of this work Dr. Bradford has died, and, a further edition now being called for, an attempt has been made to recognize if not to deal with some criticisms expressed on the first edition. The principal one was that whereas the book was entitled ""Documentation"" it dealt in the main with the Universal Decimal Classification, which Bradford did much to develop, but that it neglected other aspects and instruments of the subject of which the UDC is only one, even if an important one, of various techniques."
959	Measures of Library Effectiveness	Mathematical models of library operations are presented, allowing managers to estimate measures of effectiveness for a library.. These models describe the amount of use made of resources by a user in a visit, the distribution of book circulation in a collection, the dependence of circulation on time, and the effect of multiple copies on user satisfaction.. Predictions are made on the basis of the models of the consequence of breaking of central library into branch libraries.. The effect, in terms of frustrated use, of removing the least-used books from a collection is discussed, as are strategies for for duplication.. The emphasis is on facilitating getting results from models; for this purpose graphic techniques supplement the mathematical formulas..
1043	The MARC Pilot Project: The Final Report	The MARC project has progressed from a pilot to test the feasibility of a distribution service of centrally produced machine-readable cataloging data to a full-scale operational system in the design stages in two short years. The library community, both here and abroad, has accepted MARC and recognizes its potential for the future.  The single most significant result of MARC has been the impetus to set standards.  There is no doubt that eventually standards would have been designed for machine-readable bibliographic records, character sets, and codes for place and language.  MARC accelerated standardization and still more important, the standards are being set and agreed to be a large segment of the library community. The cooperation among the producers and users of bibliographic description has been a rewarding experience.
603	The Efficiency of MEDLARS Titles for Retrieval	Previous research has indicated that the titles rather than index terms would, in the standard MEDLARS system, gave lower Recall but higher Precision.. A title searching technique is described which allows the number of references retrieved to be fixed before a search commences.. With this technique the greater applicability of title-terms offsets their relative paucity.. The title-searching technique is tested using queries put to MEDLARS.. These queries were not specially solicited for the test.. Title searching is compared with the standard MEDLARS index term search and with an index term search with fixed output size.. For equal output sizes, Title searching retrieves 4 relevant references for every 5 retrieved by index term searching.. Thus the relative retrieval efficiency of Title and Index terms is so close that the choice of one method or the other must be primarily on economic grounds..
1036	The Management of Innovation	All the research reported in this book arose out of an attempt, some years ago, to study an industrial concern as a 'community of people at work', that is, in much the same terms one would use in a study of conduct and relationships in a village, an urban neighborhood, or a small primitive community.  This aim was never realized, because it soon became evident that the social structure of the factory interlocked with, and often mirrored, that of the small isolated town in which it was situated.  The wider study which then appeared necessary was not practicable and the enquiry petered out rather inconclusively, assuming its present significance only in the context of later studies.
1201	Communication and Epidemic Processes	It is pointed out that communication processes can be represented as epidemic processes.. Consequently, epidemic theory can be applied to the study of any process in which information is transmitted within a population.. The members of such populations need not be human beings but could be micro-organisms or even machines.. The fundamental notion of stability of an epidemic process is introduced and a stability theorem is derived.. A mechanism, called an information retrieval process, which instigates an epidemic process is defined, certain general properties of the mechanism are established and the means of controlling it are discussed.. Pontryagin's maximum principle is applied to the problem of achieving optimal control of an epidemic process and it is shown that stability of the process is equivalent to stability in the sense of Lyapunov.. This result makes it possible to determine the conditions for stability without knowledge of the solution of the differential equations which represent the process..
758	A Scientific Theory of Classification and Indexing and Its Practical Application	A classification is a theory of the structure of knowledge.. From a discussion of the nature of truth, it is held that scientific knowledge is the only knowledge which can be regarded as true.. The method of induction from empirical data is therefore applied to the construction of a classification.. Items of knowledge are divided into uniquely definable terms, called isolates, and the relations between them, called operators.. It is shown that only four basic operators exist, expressing appurtenance, equivalence, reaction, and causation; using symbols for these operators, all subjects can be analysed in a linear form called an analet.. With the addition of the permissible permutations of such analets, formed according to simple rules, alphabetical arrangement of the first terms provides a complete, logical subject index.. Examples are given, and possible difficulties are considered.. A classification can then be constructed by selection of deductive relations, arranged in hierarchical form.. The nature of possible classifications is discussed.. It is claimed that such an inductively constructed classification is the only true representation of the structure of knowledge, and that these principles provide a simple technique for accurately and fully indexing and classifying any given set of data, with complete flexibility..
986	MEDLARS:  A Summary Review and Evaluation of Three Reports	The MEDLARS (Medical Literature Analysis and Retrieval System) system at the National Library of Medicine (NLM) has over the past few years been one of the most significant and one of the most publicized automated bibliographic information retrieval systems.  Over two hundred articles on it have appeared in American newspapers and popular magazines, in specialized medical journals throughout the world, and in a variety of library journals.  The publicity that has attended this project has, in a way, been unfortunate, for it has presented an exaggerated picture of the system and its accomplishments which has only made the sceptics more skeptical; and it has obscured in part the examination of MEDLARS' real accomplishments.  There has to date been very little careful outside analysis and evaluation of MEDLARS.  Over 50 percent of all the articles listed in the bibliography in Austin's report, and virtually all the substantive ones, represent the work of persons closely connected with NLM or the development of the MEDLARS system.  Their judgement on the effectiveness of the system and its overall value cannot help but be colored by this connection.
1072	GREMAS - A System for Classification and Documentation in Organic Chemistry	"The authors of this essay were faced with the task of organizing a documentation office in which a large number of publications and patents in chemistry would have to be processed.  This large collection would be made available to a large group of elements without restrictions. To permit a large frequency of use, and to maintain this also with increases in file sizes, it becomes necessary to limit especially that faction of the task which consists in the retrieval activities paper. Savings in the retrieval activity are possible only at the expense of greater effort in indexing and by heavier use of technical aids.  We have taken the second path by consciously applying the principles	to a highly detailed faceted classification."
168	Aspects of the Theory of Syntax	"The idea that a language is based on a system of rules determining the interpretation of its infinitely many sentences is by no means novel.  Well over a century ago, it was expressed with reasonable clarity by Wilhelm von Humboldt in his famous but rarely studied introduction to general linguistics (Humboldt, 1836).  His view that a language ""makes infinite use of finite means"" and that its grammar must describe the processes that make this possible is, furthermore, a outgrowth of a persistent concern, within rationalistic philosophy of language and mind, with this ""creative"" aspect of language use (for discussion, see Chomsky, 1964, forthcoming).  What is more, it seems that even Panini's grammar can be interpreted as a fragment of such a ""generative grammar,"" in essentially the contemporary sense of this term. This monograph is an exploratory study of various problems that have arisen in the course of work on transformational grammar, which is presupposed throughout as a general framework for the discussion.  What is at issue here is precisely how this theory should be formulated.  This study deals, then, with questions that are at the border of research in transformational grammar.  For some, definite answers will be proposed; but more often the discussion will merely raise issues and consider possible approaches to them without reaching any definite conclusions."
526	On-Line Information retrieval as a Scientists Tool	The use of an on-line information retrieval system by the scientists themselves is described.. MEDUSA was designed to allow physicians to interrogate the MEDLARS data base.. A brief description is given of the system and details of an experiment to test its effectiveness.. Search formulation prepared on-line by medical research workers are compared for recall and precision with the same requests formulated by search editors in the normal way.. The results show that physicians can use an on-line system effectively..
